{
  "$schema": "uhd-test-data/1",
  "status": "standin",
  "subject": {
    "system": "quadcopter-5in",
    "modules": [
      "meps-neon-2207-v2-1950kv",
      "cnhl-black-series-1100mah-6s-100c"
    ]
  },
  "id": "hover-current",
  "title": "Hover current and all-up-weight sensitivity",
  "conditions": [
    {
      "name": "Battery nominal",
      "value": 22.2,
      "unit": "V"
    },
    {
      "name": "All-up weight (estimate)",
      "value": 604,
      "unit": "g"
    }
  ],
  "provenance": {
    "method": "Stand-in: hover thrust = AUW / motors; motor power interpolated from the maker's thrust table at that thrust; plus avionics.",
    "derivedFrom": [
      "def:meps-neon-2207-v2-1950kv:traits[type=performance].params.thrust_tests[0].rows",
      "def:meps-neon-2207-v2-1950kv:traits[type=performance].params.thrust_tests[0].propeller",
      "def:meps-neon-2207-v2-1950kv:traits[type=performance].params.thrust_tests[0].supply_V",
      "def:cnhl-black-series-1100mah-6s-100c:interfaces[id=battery_out].parameters[id=voltage].value",
      "def:cnhl-black-series-1100mah-6s-100c:interfaces[id=battery_out].parameters[id=capacity].value",
      "derived:mass.all_up"
    ],
    "assumptions": [
      "motor figures interpolate linearly between the 10 rows of the maker's table (0 at 0 % throttle); pack current = table electrical power ÷ 22.2 V nominal",
      "maker's table used the MEPS SZ4942 prop at 25.2 V, not the fitted propeller",
      "avionics: DJI O4 minimum supply power 10 W, GNSS 50 mA at 5 V, FC + receiver 2.5 W (assumed), BEC efficiency 85 % (assumed)",
      "all-up weight = 584 g from systemMass (derived:mass.all_up, of which 151.2 g is CAD volume × assumed material) + 20 g assumed for the 4 parts with no mass in the model (FC/ESC SH1.0 8-pin cable, Panasonic EEU-FR1V471 470 µF 35 V low-ESR electrolytic capacitor, XT60 battery lead (12 AWG), DJI O4 3-in-1 cable)"
    ],
    "generator": "scripts/docs/lib/standins/multirotor.ts",
    "generatedAt": "2026-09-26"
  },
  "columns": [
    {
      "id": "auw",
      "label": "All-up weight",
      "unit": "g"
    },
    {
      "id": "thrust_motor",
      "label": "Hover thrust per motor",
      "unit": "g"
    },
    {
      "id": "current_total",
      "label": "Hover current",
      "unit": "A"
    },
    {
      "id": "power_total",
      "label": "Hover power",
      "unit": "W"
    }
  ],
  "rows": [
    [
      504,
      126,
      7.02,
      156
    ],
    [
      554,
      139,
      7.73,
      172
    ],
    [
      604,
      151,
      8.45,
      188
    ],
    [
      654,
      164,
      9.16,
      203
    ],
    [
      704,
      176,
      9.87,
      219
    ],
    [
      754,
      189,
      10.58,
      235
    ]
  ],
  "summary": [
    {
      "id": "auw_g",
      "label": "All-up weight (estimate)",
      "value": 604,
      "unit": "g"
    },
    {
      "id": "hover_current_A",
      "label": "Hover current",
      "value": 8.4,
      "unit": "A"
    },
    {
      "id": "hover_power_W",
      "label": "Hover power",
      "value": 188,
      "unit": "W"
    },
    {
      "id": "avionics_current_A",
      "label": "Avionics current",
      "value": 0.68,
      "unit": "A"
    }
  ]
}
