{
  "$schema": "uhd-test-data/1",
  "status": "standin",
  "subject": {
    "system": "quadcopter-5in",
    "modules": [
      "meps-neon-2207-v2-1950kv",
      "cnhl-black-series-1100mah-6s-100c"
    ]
  },
  "id": "flight-time",
  "title": "Flight-time estimate by regime",
  "conditions": [
    {
      "name": "Capacity",
      "value": 1100,
      "unit": "mAh"
    },
    {
      "name": "Usable fraction (assumed)",
      "value": 80,
      "unit": "%"
    },
    {
      "name": "Freestyle mix",
      "value": "75 % cruise, 20 % half throttle, 5 % full",
      "unit": ""
    }
  ],
  "provenance": {
    "method": "Stand-in: time = capacity × usable fraction ÷ average current. Static-thrust currents: pessimistic for forward flight.",
    "derivedFrom": [
      "def:meps-neon-2207-v2-1950kv:traits[type=performance].params.thrust_tests[0].rows",
      "def:meps-neon-2207-v2-1950kv:traits[type=performance].params.thrust_tests[0].propeller",
      "def:meps-neon-2207-v2-1950kv:traits[type=performance].params.thrust_tests[0].supply_V",
      "def:cnhl-black-series-1100mah-6s-100c:interfaces[id=battery_out].parameters[id=voltage].value",
      "def:cnhl-black-series-1100mah-6s-100c:interfaces[id=battery_out].parameters[id=capacity].value",
      "test:hover-current:summary[id=hover_current_A].value"
    ],
    "assumptions": [
      "motor figures interpolate linearly between the 10 rows of the maker's table (0 at 0 % throttle); pack current = table electrical power ÷ 22.2 V nominal",
      "maker's table used the MEPS SZ4942 prop at 25.2 V, not the fitted propeller",
      "avionics: DJI O4 minimum supply power 10 W, GNSS 50 mA at 5 V, FC + receiver 2.5 W (assumed), BEC efficiency 85 % (assumed)",
      "all-up weight = 584 g from systemMass (derived:mass.all_up, of which 151.2 g is CAD volume × assumed material) + 20 g assumed for the 4 parts with no mass in the model (FC/ESC SH1.0 8-pin cable, Panasonic EEU-FR1V471 470 µF 35 V low-ESR electrolytic capacitor, XT60 battery lead (12 AWG), DJI O4 3-in-1 cable)",
      "usable capacity 80 % of rated"
    ],
    "generator": "scripts/docs/lib/standins/multirotor.ts",
    "generatedAt": "2026-09-26"
  },
  "columns": [
    {
      "id": "regime",
      "label": "Regime",
      "unit": ""
    },
    {
      "id": "current",
      "label": "Average current",
      "unit": "A"
    },
    {
      "id": "minutes",
      "label": "Flight time",
      "unit": "min"
    }
  ],
  "rows": [
    [
      "Hover",
      8.4,
      6.3
    ],
    [
      "Cruise (1.5 × hover thrust)",
      12.8,
      4.1
    ],
    [
      "Freestyle mix",
      25.7,
      2.1
    ],
    [
      "Full throttle",
      167.9,
      0.3
    ]
  ],
  "summary": [
    {
      "id": "hover_min",
      "label": "Hover",
      "value": 6.3,
      "unit": "min"
    },
    {
      "id": "mix_min",
      "label": "Freestyle mix",
      "value": 2.1,
      "unit": "min"
    }
  ]
}
