{
  "$schema": "uhd-test-data/1",
  "status": "standin",
  "subject": {
    "system": "quadcopter-5in",
    "modules": [
      "meps-neon-2207-v2-1950kv",
      "cnhl-black-series-1100mah-6s-100c"
    ]
  },
  "id": "throttle-sweep",
  "title": "Static thrust and current vs throttle (whole vehicle)",
  "conditions": [
    {
      "name": "Supply",
      "value": 25.2,
      "unit": "V"
    },
    {
      "name": "Propeller (maker's test)",
      "value": "MEPS SZ5145",
      "unit": ""
    },
    {
      "name": "Motors",
      "value": 4,
      "unit": ""
    }
  ],
  "provenance": {
    "method": "Stand-in: power-law fit through the motor maker's 50 % and 100 % test points, scaled to all motors, plus avionics draw.",
    "derivedFrom": [
      "def:meps-neon-2207-v2-1950kv:traits[type=performance].params.thrust_tests[0].full_throttle.thrust_g",
      "def:meps-neon-2207-v2-1950kv:traits[type=performance].params.thrust_tests[0].full_throttle.current_A",
      "def:meps-neon-2207-v2-1950kv:traits[type=performance].params.thrust_tests[0].half_throttle.thrust_g",
      "def:meps-neon-2207-v2-1950kv:traits[type=performance].params.thrust_tests[0].half_throttle.current_A",
      "def:meps-neon-2207-v2-1950kv:traits[type=performance].params.thrust_tests[0].half_throttle.power_W",
      "def:cnhl-black-series-1100mah-6s-100c:interfaces[id=battery_out].parameters[id=voltage].value",
      "def:cnhl-black-series-1100mah-6s-100c:interfaces[id=battery_out].parameters[id=capacity].value"
    ],
    "assumptions": [
      "power laws through the maker's 50 % and 100 % points: thrust ~ throttle^1.155, current ~ throttle^2.048",
      "maker's test used the MEPS SZ5145 prop at 25.2 V, not the fitted propeller",
      "avionics: DJI O4 minimum supply power 10 W, GNSS 50 mA at 5 V, FC + receiver 2.5 W (assumed), BEC efficiency 85 % (assumed)",
      "all-up weight = 425.1 g of stated masses + 125 g assumed for the 67 parts without a mass (frame, top plate, hardware; see derived:mass.missing_count)"
    ],
    "generator": "scripts/docs/lib/standins/multirotor.ts",
    "generatedAt": "2026-09-26"
  },
  "columns": [
    {
      "id": "throttle",
      "label": "Throttle",
      "unit": "%"
    },
    {
      "id": "thrust_motor",
      "label": "Thrust per motor",
      "unit": "g"
    },
    {
      "id": "current_motor",
      "label": "Current per motor",
      "unit": "A"
    },
    {
      "id": "thrust_total",
      "label": "Total thrust",
      "unit": "g"
    },
    {
      "id": "current_total",
      "label": "Total current",
      "unit": "A"
    },
    {
      "id": "power_total",
      "label": "Electrical power",
      "unit": "W"
    }
  ],
  "rows": [
    [
      0,
      0,
      0,
      0,
      0.7,
      17
    ],
    [
      10,
      119,
      0.39,
      476,
      2.2,
      56
    ],
    [
      20,
      265,
      1.59,
      1059,
      7,
      178
    ],
    [
      30,
      423,
      3.65,
      1692,
      15.3,
      385
    ],
    [
      40,
      590,
      6.59,
      2359,
      27,
      681
    ],
    [
      50,
      763,
      10.4,
      3052,
      42.3,
      1065
    ],
    [
      60,
      942,
      15.11,
      3767,
      61.1,
      1540
    ],
    [
      70,
      1125,
      20.71,
      4501,
      83.5,
      2105
    ],
    [
      80,
      1313,
      27.23,
      5252,
      109.6,
      2762
    ],
    [
      90,
      1504,
      34.66,
      6017,
      139.3,
      3510
    ],
    [
      100,
      1699,
      43,
      6796,
      172.7,
      4351
    ]
  ],
  "summary": [
    {
      "id": "thrust_total_full",
      "label": "Total static thrust at 100 %",
      "value": 6796,
      "unit": "g"
    },
    {
      "id": "current_total_full",
      "label": "Total current at 100 %",
      "value": 172.7,
      "unit": "A"
    }
  ]
}
